"id","category1","category2","category3","recommendation"
"1","sick","happy","calm","Take a warm shower to relax."
"2","sick","happy","calm","Read a good book to distract yourself."
"3","sick","happy","calm","Watch your favorite movie."
"4","sick","happy","calm","Try some herbal tea for comfort."
"5","sick","happy","calm","Listen to calming music."
"6","sick","happy","calm","Spend time with friends or family."
"7","sick","happy","calm","Practice some deep breathing exercises."
"8","sick","happy","calm","Try a gentle yoga session."
"9","sick","happy","calm","Write in a journal to express your feelings."
"10","sick","happy","calm","Take a short walk outside for fresh air."
"11","sick","happy","stressed","Take a break and watch your favorite show."
"12","sick","happy","stressed","Listen to uplifting music to boost your mood."
"13","sick","happy","stressed","Try gentle stretching or yoga to relieve stress."
"14","sick","happy","stressed","Reach out to a friend for a light-hearted chat."
"15","sick","happy","stressed","Engage in a creative hobby, like drawing or writing."
"16","sick","happy","stressed","Take a relaxing bath with soothing scents."
"17","sick","happy","stressed","Practice mindfulness or meditation for stress relief."
"18","sick","happy","stressed","Enjoy a warm cup of tea and some light snacks."
"19","sick","happy","stressed","Write down what makes you happy to reflect on it later."
"20","sick","happy","stressed","Spend time in nature, even if it's just a short walk."
"21","sick","happy","anxious","Practice deep breathing exercises to calm your mind."
"22","sick","happy","anxious","Engage in light reading to distract yourself."
"23","sick","happy","anxious","Write down your feelings to process them better."
"24","sick","happy","anxious","Listen to calming music or sounds to ease anxiety."
"25","sick","happy","anxious","Talk to someone you trust about how you feel."
"26","sick","happy","anxious","Try a guided meditation app to help you relax."
"27","sick","happy","anxious","Watch a funny movie or show to lighten your mood."
"28","sick","happy","anxious","Take a warm bath to soothe your body and mind."
"29","sick","happy","anxious","Spend time with pets for comfort and joy."
"30","sick","happy","anxious","Practice gratitude by listing things you appreciate."
"31","sick","sad","calm","Rest and allow yourself to recover fully."
"32","sick","sad","calm","Take a quiet moment to reflect and breathe deeply."
"33","sick","sad","calm","Engage in gentle stretching to relieve tension."
"34","sick","sad","calm","Write in a journal about your feelings to process them."
"35","sick","sad","calm","Sip warm herbal tea to soothe your body."
"36","sick","sad","calm","Listen to soothing music to lift your spirits."
"37","sick","sad","calm","Try guided meditation to help calm your mind."
"38","sick","sad","calm","Watch a nature documentary for a peaceful escape."
"39","sick","sad","calm","Spend some time in a quiet space with soft lighting."
"40","sick","sad","calm","Practice mindfulness to stay present and relaxed."
"41","sick","sad","stressed","Take a break and practice deep breathing exercises."
"42","sick","sad","stressed","Write down what’s stressing you out to gain clarity."
"43","sick","sad","stressed","Reach out to a friend or family member to talk."
"44","sick","sad","stressed","Engage in a relaxing activity like coloring or drawing."
"45","sick","sad","stressed","Try some gentle yoga to relieve physical tension."
"46","sick","sad","stressed","Watch a funny movie to lighten your mood."
"47","sick","sad","stressed","Create a to-do list to organize your thoughts."
"48","sick","sad","stressed","Consider speaking with a counselor for support."
"49","sick","sad","stressed","Take a warm bath with calming scents."
"50","sick","sad","stressed","Practice gratitude by listing things you are thankful for."
"51","sick","sad","anxious","Practice mindfulness to bring your focus back to the present."
"52","sick","sad","anxious","Write down your worries to help ease your mind."
"53","sick","sad","anxious","Listen to calming music or nature sounds."
"54","sick","sad","anxious","Engage in light stretching to relieve tension."
"55","sick","sad","anxious","Try a guided meditation app to calm your thoughts."
"56","sick","sad","anxious","Talk to someone you trust about how you feel."
"57","sick","sad","anxious","Create a relaxing bedtime routine to improve sleep."
"58","sick","sad","anxious","Use calming essential oils like lavender."
"59","sick","sad","anxious","Read a book that helps distract your mind."
"60","sick","sad","anxious","Limit your exposure to stressful news or social media."
"61","sick","angry","calm","Practice deep breathing to regain your calm."
"62","sick","angry","calm","Channel your anger into a creative outlet like art."
"63","sick","angry","calm","Take a walk to clear your mind and reduce tension."
"64","sick","angry","calm","Try journaling about your feelings to process them."
"65","sick","angry","calm","Use mindfulness techniques to help calm your anger."
"66","sick","angry","calm","Consider listening to soothing music to relax."
"67","sick","angry","calm","Practice progressive muscle relaxation exercises."
"68","sick","angry","calm","Talk it out with someone who understands."
"69","sick","angry","calm","Engage in gentle yoga to promote relaxation."
"70","sick","angry","calm","Visualize a peaceful scene to help calm your mind."
"71","sick","angry","stressed","Take a moment to step outside and breathe deeply."
"72","sick","angry","stressed","Engage in physical activity to release pent-up frustration."
"73","sick","angry","stressed","Write a letter to express your feelings, even if you don’t send it."
"74","sick","angry","stressed","Consider talking to a trusted friend about your feelings."
"75","sick","angry","stressed","Use a stress ball or fidget toy to help release tension."
"76","sick","angry","stressed","Try to focus on something positive to shift your mindset."
"77","sick","angry","stressed","Practice guided imagery to help reduce stress."
"78","sick","angry","stressed","Take a short break and do something you enjoy."
"79","sick","angry","stressed","Limit caffeine and sugar to help stabilize your mood."
"80","sick","angry","stressed","Explore relaxation techniques, such as deep breathing or meditation."
"81","sick","angry","anxious","Take a few minutes to practice mindfulness or meditation."
"82","sick","angry","anxious","Write down your thoughts and feelings to gain perspective."
"83","sick","angry","anxious","Try to engage in a calming activity like reading or drawing."
"84","sick","angry","anxious","Consider talking to a counselor for professional support."
"85","sick","angry","anxious","Practice gratitude by listing three things you are thankful for."
"86","sick","angry","anxious","Use calming techniques like aromatherapy or gentle music."
"87","sick","angry","anxious","Take a break from social media to reduce anxiety."
"88","sick","angry","anxious","Engage in light exercise to help reduce anxiety levels."
"89","sick","angry","anxious","Practice deep breathing exercises to regain calm."
"90","sick","angry","anxious","Try to establish a daily routine to provide structure."
"91","tired","happy","calm","Take a warm bath to relax and unwind."
"92","tired","happy","calm","Listen to soothing music while resting."
"93","tired","happy","calm","Enjoy a peaceful nature walk to rejuvenate."
"94","tired","happy","calm","Spend time with friends to share joyful moments."
"95","tired","happy","calm","Practice gentle yoga to stretch and relax."
"96","tired","happy","calm","Read a light-hearted book to lift your spirits."
"97","tired","happy","calm","Engage in a relaxing hobby, like painting or knitting."
"98","tired","happy","calm","Meditate for a few minutes to enhance tranquility."
"99","tired","happy","calm","Watch a feel-good movie or show."
"100","tired","happy","calm","Prepare a healthy meal to nourish your body."
"101","tired","happy","stressed","Take short breaks throughout the day to recharge."
"102","tired","happy","stressed","Practice deep breathing to alleviate stress."
"103","tired","happy","stressed","Jot down your thoughts to clear your mind."
"104","tired","happy","stressed","Engage in light exercise to boost endorphins."
"105","tired","happy","stressed","Try a stress-relief app for guided relaxation."
"106","tired","happy","stressed","Spend time with loved ones for emotional support."
"107","tired","happy","stressed","Limit screen time before bed to improve sleep."
"108","tired","happy","stressed","Explore new hobbies to redirect your focus."
"109","tired","happy","stressed","Consider journaling to express your feelings."
"110","tired","happy","stressed","Create a to-do list to organize your tasks."
"111","tired","happy","anxious","Practice mindfulness techniques to stay grounded."
"112","tired","happy","anxious","Engage in physical activity to reduce anxiety."
"113","tired","happy","anxious","Talk to someone about your feelings to lighten the load."
"114","tired","happy","anxious","Limit caffeine intake to help with anxiety levels."
"115","tired","happy","anxious","Take a break and practice deep breathing exercises."
"116","tired","happy","anxious","Spend time outdoors to boost your mood."
"117","tired","happy","anxious","Create a calming bedtime routine to improve sleep."
"118","tired","happy","anxious","Consider trying guided imagery for relaxation."
"119","tired","happy","anxious","Indulge in a creative activity to express yourself."
"120","tired","happy","anxious","Listen to calming podcasts or audiobooks."
"121","tired","sad","calm","Take time to rest and reflect on your feelings."
"122","tired","sad","calm","Listen to soothing music to help lift your mood."
"123","tired","sad","calm","Spend a quiet evening journaling your thoughts."
"124","tired","sad","calm","Practice meditation to find inner peace."
"125","tired","sad","calm","Enjoy a cup of herbal tea while relaxing."
"126","tired","sad","calm","Engage in gentle stretching to release tension."
"127","tired","sad","calm","Take a walk in a serene environment."
"128","tired","sad","calm","Try deep breathing exercises to calm your mind."
"129","tired","sad","calm","Reflect on positive memories to improve your mood."
"130","tired","sad","calm","Practice gratitude by writing down things you appreciate."
"131","tired","sad","stressed","Take a break from your routine to recharge."
"132","tired","sad","stressed","Write down your thoughts to process your emotions."
"133","tired","sad","stressed","Talk to a friend about how you’re feeling."
"134","tired","sad","stressed","Engage in a physical activity to relieve stress."
"135","tired","sad","stressed","Limit your exposure to stressful situations."
"136","tired","sad","stressed","Practice time management to reduce overwhelm."
"137","tired","sad","stressed","Create a calming environment at home."
"138","tired","sad","stressed","Consider a short vacation or a weekend getaway."
"139","tired","sad","stressed","Use relaxation apps for guided meditation."
"140","tired","sad","stressed","Focus on one task at a time to avoid feeling overwhelmed."
"141","tired","sad","anxious","Practice mindfulness to stay present and reduce anxiety."
"142","tired","sad","anxious","Engage in light exercise to improve your mood."
"143","tired","sad","anxious","Limit social media to reduce anxiety triggers."
"144","tired","sad","anxious","Talk to someone who can offer support."
"145","tired","sad","anxious","Focus on your breathing to calm your nerves."
"146","tired","sad","anxious","Create a calming bedtime routine to help you unwind."
"147","tired","sad","anxious","Try journaling to express and understand your feelings."
"148","tired","sad","anxious","Engage in creative activities to distract your mind."
"149","tired","sad","anxious","Consider talking to a counselor for additional support."
"150","tired","sad","anxious","Take a moment to step outside for fresh air and perspective."
"151","tired","angry","calm","Take deep breaths to soothe your anger."
"152","tired","angry","calm","Practice mindfulness to regain your inner peace."
"153","tired","angry","calm","Engage in a calming activity like reading."
"154","tired","angry","calm","Listen to calming music to relax your mind."
"155","tired","angry","calm","Spend time in nature to clear your head."
"156","tired","angry","calm","Write down your feelings to process your emotions."
"157","tired","angry","calm","Do some gentle yoga to release tension."
"158","tired","angry","calm","Reflect on what’s causing your anger and find solutions."
"159","tired","angry","calm","Talk it out with someone you trust to lighten the burden."
"160","tired","angry","calm","Engage in a hobby that brings you joy and relaxation."
"161","tired","angry","stressed","Take a short break to clear your mind."
"162","tired","angry","stressed","Engage in physical exercise to release pent-up energy."
"163","tired","angry","stressed","Identify the sources of your stress and tackle them one by one."
"164","tired","angry","stressed","Consider writing a letter to express your feelings."
"165","tired","angry","stressed","Practice progressive muscle relaxation techniques."
"166","tired","angry","stressed","Limit your exposure to stressful situations when possible."
"167","tired","angry","stressed","Create a to-do list to organize your tasks."
"168","tired","angry","stressed","Take time for self-care activities that you enjoy."
"169","tired","angry","stressed","Reach out for support from friends or family."
"170","tired","angry","stressed","Explore breathing exercises to help calm your mind."
"171","tired","angry","anxious","Practice grounding techniques to stay present."
"172","tired","angry","anxious","Limit caffeine and sugar to help manage anxiety."
"173","tired","angry","anxious","Talk to someone who can provide support and understanding."
"174","tired","angry","anxious","Engage in art or writing to express your emotions."
"175","tired","angry","anxious","Focus on your breathing to reduce anxiety levels."
"176","tired","angry","anxious","Consider talking to a professional for guidance."
"177","tired","angry","anxious","Create a calming evening routine to relax before bed."
"178","tired","angry","anxious","Take time for physical activity to channel your energy."
"179","tired","angry","anxious","Practice gratitude to shift your mindset."
"180","tired","angry","anxious","Explore relaxation apps or meditation guides."
"181","energetic","happy","calm","Channel your energy into a creative project."
"182","energetic","happy","calm","Take a moment to appreciate the beauty around you."
"183","energetic","happy","calm","Engage in activities that bring you joy and relaxation."
"184","energetic","happy","calm","Spend time with friends and share positive vibes."
"185","energetic","happy","calm","Practice gratitude by reflecting on your blessings."
"186","energetic","happy","calm","Try meditation to enhance your positive feelings."
"187","energetic","happy","calm","Listen to uplifting music that keeps you in a good mood."
"188","energetic","happy","calm","Enjoy a walk in nature to appreciate the moment."
"189","energetic","happy","calm","Take care of plants or pets to nurture your calmness."
"190","energetic","happy","calm","Plan a fun outing or adventure with friends."
"191","energetic","happy","stressed","Use your energy to tackle the tasks causing stress."
"192","energetic","happy","stressed","Dance or exercise to release built-up stress."
"193","energetic","happy","stressed","Try time management techniques to organize your tasks."
"194","energetic","happy","stressed","Take breaks between activities to recharge."
"195","energetic","happy","stressed","Engage in hobbies that help you unwind."
"196","energetic","happy","stressed","Reach out to friends for support and encouragement."
"197","energetic","happy","stressed","Practice mindfulness to stay centered amid chaos."
"198","energetic","happy","stressed","Make a list of priorities to ease decision-making."
"199","energetic","happy","stressed","Consider trying yoga to combine movement with relaxation."
"200","energetic","happy","stressed","Limit exposure to stressors and focus on positive activities."
"201","energetic","happy","anxious","Channel your energy into physical activity to ease anxiety."
"202","energetic","happy","anxious","Practice deep breathing to calm your mind."
"203","energetic","happy","anxious","Focus on positive affirmations to combat anxious thoughts."
"204","energetic","happy","anxious","Engage in creative activities to distract your mind."
"205","energetic","happy","anxious","Connect with friends to share your feelings."
"206","energetic","happy","anxious","Take short breaks to reset and refocus."
"207","energetic","happy","anxious","Explore relaxation techniques like guided imagery."
"208","energetic","happy","anxious","Limit your caffeine intake to help reduce anxiety."
"209","energetic","happy","anxious","Try journaling to express and process your thoughts."
"210","energetic","happy","anxious","Consider meditation to promote a sense of calm."
"211","energetic","sad","calm","Engage in physical activity to lift your spirits."
"212","energetic","sad","calm","Listen to music that resonates with your feelings."
"213","energetic","sad","calm","Express your emotions through art or writing."
"214","energetic","sad","calm","Spend time in nature to reflect and rejuvenate."
"215","energetic","sad","calm","Practice mindfulness to stay grounded."
"216","energetic","sad","calm","Talk to someone about how you feel to gain perspective."
"217","energetic","sad","calm","Try yoga to harmonize your energy and emotions."
"218","energetic","sad","calm","Create a self-care routine to nurture yourself."
"219","energetic","sad","calm","Engage in activities that you love to lift your mood."
"220","energetic","sad","calm","Reflect on positive moments to shift your focus."
"221","energetic","sad","stressed","Channel your energy into a creative outlet to express your feelings."
"222","energetic","sad","stressed","Engage in physical activity to release stress and improve your mood."
"223","energetic","sad","stressed","Take short breaks during tasks to manage stress effectively."
"224","energetic","sad","stressed","Talk to someone about your feelings to gain support."
"225","energetic","sad","stressed","Practice relaxation techniques like deep breathing."
"226","energetic","sad","stressed","Focus on activities that bring you joy to counteract sadness."
"227","energetic","sad","stressed","Create a playlist of uplifting songs to boost your spirits."
"228","energetic","sad","stressed","Spend time outdoors to change your environment and mindset."
"229","energetic","sad","stressed","Try journaling to explore and understand your emotions."
"230","energetic","sad","stressed","Limit exposure to negative influences that contribute to stress."
"231","energetic","sad","anxious","Engage in physical activity to help alleviate anxiety."
"232","energetic","sad","anxious","Practice mindfulness techniques to stay present."
"233","energetic","sad","anxious","Talk to someone about your feelings to find support."
"234","energetic","sad","anxious","Focus on your breathing to help calm your mind."
"235","energetic","sad","anxious","Engage in hobbies that require focus to distract from anxiety."
"236","energetic","sad","anxious","Consider yoga to combine movement with relaxation."
"237","energetic","sad","anxious","Write down your thoughts to process your emotions."
"238","energetic","sad","anxious","Listen to calming music to help ease your mind."
"239","energetic","sad","anxious","Limit caffeine intake to reduce feelings of anxiety."
"240","energetic","sad","anxious","Spend time with supportive friends to help lighten your mood."
"241","energetic","angry","calm","Use your energy to engage in a physical activity to release anger."
"242","energetic","angry","calm","Practice mindfulness to channel your energy positively."
"243","energetic","angry","calm","Try deep breathing exercises to maintain your calm."
"244","energetic","angry","calm","Talk to someone to express your feelings constructively."
"245","energetic","angry","calm","Engage in activities that promote relaxation and calmness."
"246","energetic","angry","calm","Reflect on the source of your anger to understand it better."
"247","energetic","angry","calm","Consider meditation to balance your emotions."
"248","energetic","angry","calm","Use physical exercise as a constructive outlet for your anger."
"249","energetic","angry","calm","Focus on positive affirmations to shift your mindset."
"250","energetic","angry","calm","Explore creative outlets like art to express your feelings."
"251","energetic","angry","stressed","Engage in vigorous physical activity to release stress."
"252","energetic","angry","stressed","Practice anger management techniques to cope with feelings."
"253","energetic","angry","stressed","Identify stressors and work on addressing them."
"254","energetic","angry","stressed","Talk to a trusted friend about your feelings."
"255","energetic","angry","stressed","Try relaxation techniques to calm your mind."
"256","energetic","angry","stressed","Focus on problem-solving to reduce feelings of helplessness."
"257","energetic","angry","stressed","Consider journaling to express and process your emotions."
"258","energetic","angry","stressed","Limit exposure to situations that trigger anger and stress."
"259","energetic","angry","stressed","Engage in mindfulness practices to stay centered."
"260","energetic","angry","stressed","Find healthy distractions to take your mind off stress."
"261","energetic","angry","anxious","Use your energy to channel it into a physical workout."
"262","energetic","angry","anxious","Practice breathing exercises to calm your mind."
"263","energetic","angry","anxious","Identify triggers for your anger and anxiety to manage them."
"264","energetic","angry","anxious","Talk to a supportive friend about your feelings."
"265","energetic","angry","anxious","Engage in calming activities like yoga or meditation."
"266","energetic","angry","anxious","Try journaling to express your emotions effectively."
"267","energetic","angry","anxious","Limit caffeine intake to help reduce anxiety levels."
"268","energetic","angry","anxious","Focus on activities that require concentration to distract your mind."
"269","energetic","angry","anxious","Practice gratitude to shift your focus away from negativity."
"270","energetic","angry","anxious","Explore creative outlets to express your emotions healthily."
